{
  "$schema": "http://json-schema.org/draft-07/schema#",
  "title": "DAA-post struktureret udtræk (trin ③)",
  "description": "Ét objekt per stamtavle-post — KUN struktureret rygrad. UDLED IKKE narrative: den ordrette prosa flettes deterministisk ind fra posts.json (raw_text) af validate.py, så den aldrig trunkeres/parafraseres. Opret ALDRIG tredjeparts-personer (konger, paver, vidner) — de nævnes kun. Hver dato-værdi SKAL forekomme ordret i kilde-postens raw_text.",
  "type": "object",
  "required": ["linje", "nr", "nr_label", "navn"],
  "additionalProperties": false,
  "properties": {
    "linje": {"type": "string", "description": "romertal, fx 'I'"},
    "nr": {"type": "integer", "description": "basenummer i linjen (15a/15b -> 15)"},
    "nr_label": {"type": "string", "description": "fuldt løbenummer som i bogen, fx '15a' eller '47' — kopier verbatim fra posten"},
    "usikker": {"type": "boolean", "description": "true hvis posten havde '?'-præfiks (bogens markør for formodet/usikkert medlemskab) -> konfidens"},
    "er_omtale": {"type": "boolean", "description": "TRUE hvis 'posten' i virkeligheden kun er en OMTALE af en person inde i løbende prosa (oversigtsafsnit, 'Fader til X', 'hvis Sønner var a-d'), og ikke et selvstændigt nummereret opslag. En omtale må ALDRIG blive til en person — den samme person har typisk sit rigtige opslag et andet sted i bogen. Dette gav ~30 spøgelsespersoner i DAA 1939; sæt hellere true ved tvivl, så valideringen kan spærre."},
    "tekst_afhugget": {"type": "boolean", "description": "TRUE hvis postens prosa begynder eller slutter midt i en sætning, fordi segmenteringen har klippet forkert. Dette er IKKE det samme som er_omtale: en afhugget post er en RIGTIG person hvis tekst vi mangler noget af, og den skal re-segmenteres — ikke kasseres. Kalibreringen 2026-07-29 viste at sammenblandingen får modellen til at markere virkelige mennesker som omtaler."},
    "navn": {"type": "string", "description": "KUN personens egennavn. Titler, rang, godsbesiddelser og parenteser hører i titel-fakta/godser — ALDRIG i navnet. Forkert: 'Kammerherre Christian Ditlev Reventlow til Grevskabet Christianssæde'. Rigtigt: navn='Christian Ditlev', titel-fakta='Kammerherre', gods='Grevskabet Christianssæde'."},
    "tilnavn": {"type": ["string", "null"], "description": "fx 'kaldet Kale'"},
    "koen": {"type": ["string", "null"], "enum": ["mand", "kvinde", "ukendt", null]},
    "koen_kilde": {"type": ["string", "null"], "enum": ["bog", "udledt", null], "description": "'bog' hvis kønnet står i teksten (fx 'Datteren', 'hans Søn', 'Comtesse'); 'udledt' hvis det er sluttet af fornavnet eller sammenhængen. Skøn må ikke kunne forveksles med kildens udsagn — gates bygger på dette."},
    "facts": {
      "type": "array",
      "items": {
        "type": "object",
        "required": ["faktatype"],
        "additionalProperties": false,
        "properties": {
          "faktatype": {"type": "string", "description": "navn|fødsel|død|floruit|dåb|begravelse|titel|adling|naturalisering|introduktion_ridderhus|dekoration|dødsårsag|... — brug ALTID 'begravelse' som kanonisk type (også for bisættelse/bis.)"},
          "vaerdi": {"type": ["string", "null"]},
          "date_raw": {"type": ["string", "null"], "description": "ordret som i bogen — SKAL findes i narrative. For ALLE dato-fakta (fødsel/død/floruit/dåb/begravelse) er date_raw OBLIGATORISK og kopieres verbatim; syntetisér ALDRIG en normaliseret span i vaerdi i stedet (floruit-spanet hører i date_min/date_max + verbatim i date_raw)."},
          "date_min": {"type": ["string", "null"], "description": "ISO YYYY-MM-DD el. null"},
          "date_max": {"type": ["string", "null"]},
          "date_qualifier": {"type": ["string", "null"], "enum": ["exact", "before", "after", "about", "between", "floruit", "until_event", "open_end", "ongoing", null], "description": "RELATION mellem dato og begivenhed. Brug 'about' for ca./o./um (IKKE 'circa'/'approx'). 'before'→date_min null; 'after'→date_max null."},
          "date_certainty": {"type": ["string", "null"], "enum": ["certain", "uncertain", "ambiguous", null], "description": "LÆSE-sikkerhed, ortogonal til date_qualifier: 'uncertain' hvis kilden selv tvivler (fx '147(5?)', OCR-tvivl), 'ambiguous' ved flere lige gyldige tolkninger. Udelad/null hvis læsningen er sikker."},
          "calendar": {"type": ["string", "null"], "enum": ["gregoriansk", "juliansk", null], "description": "Sæt kun 'juliansk' hvis kilden eksplicit angiver juliansk/gl. stil. Kirkelige mærkedage → dato konverteres deterministisk af validate.py (som sætter calendar). Ellers udelad (DB-default gregoriansk)."},
          "sted": {"type": ["string", "null"]},
          "kilde_span": {"type": ["string", "null"], "description": "mindste klausul i raw_text der indeholder dette faktas anker (dato/værdi). SKAL være substring af raw_text. Bruges til felt-proveniens (citation.citat_tekst)."}
        }
      }
    },
    "godser": {
      "type": "array",
      "items": {
        "type": "object",
        "required": ["navn"],
        "additionalProperties": false,
        "properties": {
          "navn": {"type": "string"},
          "periode_raw": {"type": ["string", "null"]},
          "period_type": {"type": ["string", "null"]},
          "sted": {"type": ["string", "null"], "description": "sogn/kreds, fx 'Selent S., Plön Kr.'"}
        }
      }
    },
    "embeder": {
      "type": "array",
      "items": {
        "type": "object",
        "required": ["rolle"],
        "additionalProperties": false,
        "properties": {
          "organisation": {"type": ["string", "null"]},
          "rolle": {"type": "string"},
          "dato_raw": {"type": ["string", "null"]}
        }
      }
    },
    "aegteskaber": {
      "type": "array",
      "items": {
        "type": "object",
        "required": ["ordinal"],
        "additionalProperties": false,
        "properties": {
          "ordinal": {"type": "integer", "description": "1, 2, 3 (gift 1°/2°/3°)"},
          "ordinal_kilde": {"type": ["string", "null"], "enum": ["bog", "udledt", null], "description": "'bog' KUN hvis bogen selv nummererer ægteskabet (1°/2°/3°); 'udledt' hvis nummeret er din egen optælling af rækkefølgen. Et udledt nummer kan ikke bære en varig nøgle — se docs/decisions.md om identitet der udstedes frem for udledes."},
          "partner_navn": {"type": ["string", "null"], "description": "KUN ægtefællens egennavn + slægtsnavn. Titler, rang og godser hører i partner_titel/partner_godser — ikke i navnet."},
          "partner_koen": {"type": ["string", "null"], "enum": ["mand", "kvinde", "ukendt", null], "description": "Ægtefællens køn. OBLIGATORISK at forsøge: gift-ind ægtefæller har ingen egen post, så dette er eneste kilde. 625 personer manglede køn efter DAA 1939-udtrækket, fordi feltet ikke fandtes."},
          "partner_koen_kilde": {"type": ["string", "null"], "enum": ["bog", "udledt", null]},
          "partner_titel": {"type": ["string", "null"], "description": "ægtefællens titel/rang, fx 'Kammerherre', 'Comtesse' — holdt UDE af partner_navn"},
          "partner_godser": {"type": "array", "items": {"type": "string"}, "description": "godser ægtefællen skrives 'til', fx 'Grünholz'. Holdes UDE af partner_navn; 85 ægtefæller havde gods inde i navnefeltet efter DAA 1939-udtrækket."},
          "partner_ekstern_ref": {"type": ["string", "null"], "description": "fx 'DAA 1930, II, 71' — ekstern kilde/identitet, IKKE ny person"},
          "type": {"type": ["string", "null"], "enum": ["vielse", "partnerskab", "ugift union", null]},
          "dato_raw": {"type": ["string", "null"], "description": "vielsesdato ordret, fx 'g. 26. juli 1975' — årstal SKAL findes i raw_text"},
          "date_min": {"type": ["string", "null"], "description": "ISO YYYY-MM-DD el. null"},
          "date_max": {"type": ["string", "null"]},
          "sted": {"type": ["string", "null"], "description": "vielsessted"},
          "skilt": {"type": "boolean", "description": "true hvis ægteskabet blev opløst (skilt)"},
          "partner_foedsel": {"$ref": "#/$defs/datofakta", "description": "gift-ind ægtefælles fødsel (de har ingen egen post; data står i denne post)"},
          "partner_daab": {"$ref": "#/$defs/datofakta", "description": "ægtefælles dåb"},
          "partner_doed": {"$ref": "#/$defs/datofakta", "description": "ægtefælles død"},
          "partner_erhverv": {"type": "array", "items": {"type": "string"}, "description": "ægtefælles erhverv + akademiske grader. Foreløbig IKKE rygrads-fakta — loaderen folder dem ind i ægtefællens bio-note (de har ingen narrativ)."},
          "partner_foraeldre": {"type": ["string", "null"], "description": "ægtefælles forældre fra '(F.: …)' — tekst, ikke nye personer"},
          "note": {"type": ["string", "null"], "description": "anden fri tekst om ægteskabet"},
          "kilde_span": {"type": ["string", "null"], "description": "klausulen i raw_text dette ægteskab kom fra; SKAL være substring af raw_text"}
        }
      }
    },
    "boern": {
      "type": ["object", "null"],
      "additionalProperties": false,
      "properties": {
        "antal": {"type": ["integer", "null"]},
        "slaegtled": {"type": ["string", "null"]},
        "linje": {"type": ["string", "null"]},
        "nr_range": {"type": ["array", "null"], "items": {"type": "integer"}, "description": "[lav, høj]"}
      }
    },
    "begivenheder": {
      "type": "array",
      "items": {
        "type": "object",
        "required": ["navn", "rolle"],
        "additionalProperties": false,
        "properties": {
          "navn": {"type": "string"},
          "rolle": {"type": "string"},
          "dato_raw": {"type": ["string", "null"]}
        }
      }
    },
    "narrative": {"type": ["string", "null"], "description": "UDLED IKKE — flettes deterministisk fra posts.json af validate.py. Felt tolereres men ignoreres/overskrives."}
  },
  "$defs": {
    "datofakta": {
      "type": ["object", "null"],
      "additionalProperties": false,
      "properties": {
        "date_raw": {"type": ["string", "null"], "description": "som læst; årstal SKAL findes i raw_text"},
        "date_min": {"type": ["string", "null"], "description": "ISO YYYY-MM-DD el. null"},
        "date_max": {"type": ["string", "null"]},
        "sted": {"type": ["string", "null"]}
      }
    }
  }
}
