{
  "linje": "I",
  "nr": 103,
  "nr_label": "103",
  "usikker": false,
  "navn": "Detlef",
  "tilnavn": null,
  "koen": "mand",
  "facts": [
    {
      "faktatype": "fødsel",
      "vaerdi": "1646",
      "date_raw": "* 1646",
      "date_min": "1646-01-01",
      "date_max": "1646-12-31",
      "date_qualifier": "exact",
      "sted": null
    },
    {
      "faktatype": "død",
      "vaerdi": "1690",
      "date_raw": "† 1690",
      "date_min": "1690-01-01",
      "date_max": "1690-12-31",
      "date_qualifier": "exact",
      "sted": null
    }
  ],
  "godser": [
    {
      "navn": "Lammershagen",
      "periode_raw": "(1667-1668)",
      "period_type": "tenure",
      "sted": null
    },
    {
      "navn": "Selent",
      "periode_raw": null,
      "period_type": null,
      "sted": null
    },
    {
      "navn": "Bäslin",
      "periode_raw": null,
      "period_type": null,
      "sted": null
    },
    {
      "navn": "Bauersdorf",
      "periode_raw": null,
      "period_type": null,
      "sted": null
    },
    {
      "navn": "Wittenberg",
      "periode_raw": "(1676-†)",
      "period_type": "tenure",
      "sted": null
    },
    {
      "navn": "Tresdorf",
      "periode_raw": "(1676-†)",
      "period_type": "tenure",
      "sted": null
    }
  ],
  "embeder": [
    {
      "organisation": "Kiel",
      "rolle": "immatrikuleret",
      "dato_raw": "1665"
    },
    {
      "organisation": null,
      "rolle": "kammerjunker",
      "dato_raw": "1669"
    }
  ],
  "aegteskaber": [
    {
      "ordinal": 1,
      "partner_navn": "[ukendt hustru]",
      "partner_ekstern_ref": null,
      "type": "vielse",
      "dato_raw": "Gift 1673",
      "date_min": "1673-01-01",
      "date_max": "1673-12-31",
      "sted": null,
      "skilt": false,
      "partner_foedsel": null,
      "partner_daab": null,
      "partner_doed": null,
      "partner_erhverv": [],
      "partner_foraeldre": null,
      "note": "Hustruen nævnes ikke ved navn i den synlige tekst."
    }
  ],
  "boern": null,
  "begivenheder": []
}