{
  "linje": "III",
  "nr": 11,
  "nr_label": "11",
  "usikker": false,
  "navn": "Margareta",
  "tilnavn": null,
  "koen": "kvinde",
  "facts": [
    {
      "faktatype": "død",
      "vaerdi": "25. sept. 1388",
      "date_raw": "† 25. sept. 1388",
      "date_min": "1388-09-25",
      "date_max": "1388-09-25",
      "date_qualifier": "exact",
      "sted": null
    }
  ],
  "godser": [
    {
      "navn": "Harmstorf",
      "periode_raw": "(-1378)",
      "period_type": "tenure",
      "sted": null
    }
  ],
  "embeder": [],
  "aegteskaber": [
    {
      "ordinal": 1,
      "partner_navn": "Johann Moltke",
      "partner_ekstern_ref": "DAA 1991-93, 842",
      "type": "vielse",
      "dato_raw": "Gift før 1378",
      "date_min": null,
      "date_max": "1378-12-31",
      "sted": null,
      "skilt": false,
      "partner_foedsel": null,
      "partner_daab": null,
      "partner_doed": {
        "date_raw": "† 10. aug. 1391",
        "date_min": "1391-08-10",
        "date_max": "1391-08-10",
        "sted": null
      },
      "partner_erhverv": [],
      "partner_foraeldre": "Woldemar M. til Neukirchen og NN",
      "note": "Bisat i Doberan Klosterkirke; gravsten over begge endnu i kirken."
    },
    {
      "ordinal": 2,
      "partner_navn": "Adelheid Küle",
      "partner_ekstern_ref": null,
      "type": "vielse",
      "dato_raw": "gift 2° mellem 1388 og 1391",
      "date_min": "1388-01-01",
      "date_max": "1391-12-31",
      "sted": null,
      "skilt": false,
      "partner_foedsel": null,
      "partner_daab": null,
      "partner_doed": null,
      "partner_erhverv": [],
      "partner_foraeldre": null,
      "note": null
    }
  ],
  "boern": null,
  "begivenheder": []
}