{
  "linje": "II",
  "nr": 31,
  "nr_label": "31",
  "usikker": false,
  "navn": "Brigitta Juliana Elisabeth",
  "tilnavn": null,
  "koen": "kvinde",
  "facts": [
    {
      "faktatype": "fødsel",
      "vaerdi": "13. april 1726",
      "date_raw": "* 13. april 1726",
      "date_min": "1726-04-13",
      "date_max": "1726-04-13",
      "date_qualifier": "exact",
      "sted": null
    },
    {
      "faktatype": "død",
      "vaerdi": "10. nov. 1764",
      "date_raw": "† 10. nov. 1764",
      "date_min": "1764-11-10",
      "date_max": "1764-11-10",
      "date_qualifier": "exact",
      "sted": null
    }
  ],
  "godser": [],
  "embeder": [],
  "aegteskaber": [],
  "boern": null,
  "begivenheder": []
}