{
  "linje": "V",
  "nr": 174,
  "nr_label": "174",
  "usikker": false,
  "navn": "Komtesse Sybille",
  "tilnavn": null,
  "koen": "kvinde",
  "facts": [
    {
      "faktatype": "fødsel",
      "vaerdi": "1948-03-19",
      "date_raw": "19. marts 1948",
      "date_min": "1948-03-19",
      "date_max": "1948-03-19",
      "date_qualifier": "exact",
      "sted": "Køge"
    },
    {
      "faktatype": "dåb",
      "vaerdi": "1948-06-13",
      "date_raw": "døbt 13. juni s.å. i Herfølge Kirke",
      "date_min": "1948-06-13",
      "date_max": "1948-06-13",
      "date_qualifier": "exact",
      "sted": "Herfølge Kirke"
    }
  ],
  "aegteskaber": [
    {
      "ordinal": 1,
      "partner_navn": "Jørgen Troelssøn Fink",
      "partner_ekstern_ref": null,
      "type": "vielse",
      "dato_raw": "Gift 14. sept. 1985",
      "date_min": "1985-09-14",
      "date_max": "1985-09-14",
      "sted": "Mariager",
      "skilt": false,
      "partner_foedsel": "* 14. maj 1947 i København",
      "partner_daab": "døbt 23. aug. s.å. i Sankt Petri Kirke, Aarhus",
      "partner_doed": {
        "date_raw": "† 8. sept. 2020 i Horsens",
        "date_min": "2020-09-08",
        "date_max": "2020-09-08",
        "sted": "Horsens"
      },
      "partner_erhverv": [
        "centerleder",
        "dr.phil."
      ],
      "partner_foraeldre": "Generalkonsul, professor, dr.phil. Troels Marstrand Trier F. og Kirsten Holst-Knudsen",
      "note": null
    }
  ]
}